title,stars,text,publishedAtDate,likesCount,name,reviewerNumberOfReviews,isLocalGuide,responseFromOwnerDate,responseFromOwnerText,publishAt,rating,reviewContext/Meal type,reviewContext/Parking space,reviewContext/Price per person,reviewContext/Recommendation for vegetarians,reviewContext/Service,reviewDetailedRating/Atmosphere,reviewDetailedRating/Food,reviewDetailedRating/Service,reviewId,reviewImageUrls/0,reviewImageUrls/1,reviewImageUrls/2,reviewImageUrls/3,reviewImageUrls/4,reviewOrigin,reviewUrl,reviewerId,reviewerPhotoUrl,reviewerUrl,textTranslated,reviewContext/Parking type options,reviewImageUrls/5,reviewImageUrls/6,reviewImageUrls/7,reviewImageUrls/8,reviewImageUrls/9,reviewImageUrls/10,reviewImageUrls/11,reviewImageUrls/12,reviewImageUrls/13,reviewImageUrls/14,reviewImageUrls/15,reviewImageUrls/16
Papa Johns Pizza,4,,2024-02-25T23:57:54.838Z,0,,56,TRUE,,,a month ago,,,,,,,4,5,4,ChdDSUhNMG9nS0VJQ0FnSURkOWZTVl9BRRAB,,,,,,Google,,104865514602874179546,,,,,,,,,,,,,,,,
Papa Johns Pizza,5,,2024-01-30T13:18:20.334Z,0,,101,TRUE,,,2 months ago,,,,,,,,,,ChZDSUhNMG9nS0VJQ0FnSUN0dnB2clNBEAE,,,,,,Google,,103219414754133481081,,,,,,,,,,,,,,,,
Papa Johns Pizza,1,The  pizza was ice cold and there was no cheese on the pizza (at all) my daughter was starving otherwise I’d have a picture. . I paid $25 for a large 1 topping! I’ve had hot pockets that have tasted better. Tighten up,2024-01-27T15:34:59.612Z,0,,1,FALSE,,,2 months ago,,,,,,,,1,3,ChZDSUhNMG9nS0VJQ0FnSUROMzdYbU9REAE,,,,,,Google,,115752622980965674787,,,,,,,,,,,,,,,,
Papa Johns Pizza,5,AJ is a fantastic employee and helped me out with the cancellation process when I mistakenly ordered to the wrong store. Best Papa John’s experience I’ve ever had!,2024-01-24T01:15:38.558Z,0,,2,FALSE,,,2 months ago,,,,,,,5,5,5,ChdDSUhNMG9nS0VJQ0FnSUROdVlUdmtnRRAB,,,,,,Google,,107008961262683083385,,,,,,,,,,,,,,,,
Papa Johns Pizza,5,,2024-01-21T00:00:02.440Z,0,,,FALSE,,,3 months ago,,,,,,Take out,5,5,5,ChZDSUhNMG9nS0VJQ0FnSUROZ3NIT0xBEAE,,,,,,Google,,106465032848499163401,,,,,,,,,,,,,,,,
Papa Johns Pizza,3,"I’ll start off with saying the pizza was still great, after we warmed it up again…. The  delivery driver laid it on our rail and did not knock to let us know it was here. We eventually found it, and it was cold.
Honestly the mananger was straight forward and an awesome person to work with. He helped us out and that was that.",2024-01-07T05:17:40.453Z,0,,4,FALSE,,,3 months ago,,Dinner,,$10–20,,Delivery,1,5,3,ChZDSUhNMG9nS0VJQ0FnSUQxenF2akZREAE,,,,,,Google,,104759167018044092095,,,,,,,,,,,,,,,,
Papa Johns Pizza,1,"I ordered a large veggie and a large cheese pizza, They were so bad the cheese was hard and dry the veggie pizza was so horrible.",2024-01-06T19:49:11.791Z,1,,14,FALSE,,,3 months ago,,,,,,Take out,2,1,3,ChZDSUhNMG9nS0VJQ0FnSUQxcHRLemVnEAE,,,,,,Google,,116936219946813959825,,,,,,,,,,,,,,,,
Papa Johns Pizza,1,Pizza was cold and hard .,2023-12-10T14:24:22.820Z,0,,2,FALSE,,,4 months ago,,Dinner,,$20–30,,Take out,1,1,1,ChdDSUhNMG9nS0VJQ0FnSURWOE9IZWpRRRAB,,,,,,Google,,107254889673041571200,,,,,,,,,,,,,,,,
Papa Johns Pizza,2,,2023-12-05T11:38:15.069Z,0,,134,FALSE,,,4 months ago,,,,,,,1,1,1,ChdDSUhNMG9nS0VJQ0FnSUNWaE1TcnFRRRAB,,,,,,Google,,118088470019541876696,,,,,,,,,,,,,,,,
Papa Johns Pizza,1,"Not sure what happened here, recently delivery times have been over an hour and food is cold on arrival. Their delivery method switched to Door dash instead of internal drivers and since then it’s been lame. bummer",2023-10-05T23:58:55.794Z,0,,4,FALSE,,,6 months ago,,Dinner,,$20–30,,Delivery,1,1,1,ChdDSUhNMG9nS0VJQ0FnSURaOWVHdXB3RRAB,,,,,,Google,,100384017137900100421,,,,,,,,,,,,,,,,
Papa Johns Pizza,1,They do not answer the phone. They let the phone ring and keep putting you back in queue. They did not deliver my full order but I have no way of getting in contact with anyone. I had to submit feedback and have to wait 24-48 hours for someone to contact me.,2023-09-01T01:38:06.888Z,1,,4,FALSE,,,7 months ago,,,,,,,,,1,ChdDSUhNMG9nS0VJQ0FnSURwbjhqcjRRRRAB,,,,,,Google,,116086001641505238645,,,,,,,,,,,,,,,,
Papa Johns Pizza,5,Good,2023-08-27T00:58:03.246Z,0,,37,FALSE,,,7 months ago,,,,,,,5,5,5,ChdDSUhNMG9nS0VJQ0FnSURwcmRlaS1BRRAB,,,,,,Google,,106456152616917372915,,,,,,,,,,,,,,,,
Papa Johns Pizza,5,,2023-08-15T16:14:03.985Z,0,,68,TRUE,,,8 months ago,,,,,,,4,4,4,ChZDSUhNMG9nS0VJQ0FnSURwbVB2Y0NREAE,,,,,,Google,,103152463911118020765,,,,,,,,,,,,,,,,
Papa Johns Pizza,5,"Excelente servicio, la cajera muy amable y la pizza deliciosa, por un bajo precio, una pizza gourmet 👌🏼",2023-08-07T19:49:17.785Z,0,,3,FALSE,,,8 months ago,,Dinner,Plenty of parking,$1–10,,Dine in,4,5,5,ChdDSUhNMG9nS0VJQ0FnSUNwMWRmRzZnRRAB,,,,,,Google,,112435072325584908322,,,"Excellent service, very friendly cashier and delicious pizza, for a low price, a gourmet pizza 👌🏼",,,,,,,,,,,,,
Papa Johns Pizza,1,,2023-08-05T02:58:15.436Z,0,,7,FALSE,,,8 months ago,,Dinner,,$10–20,,Delivery,5,5,1,ChdDSUhNMG9nS0VJQ0FnSUNwd2JtS3VBRRAB,,,,,,Google,,101890755939084837987,,,,,,,,,,,,,,,,
Wendy's,4,,2024-04-11T14:07:03.294Z,0,,4,FALSE,,,a week ago,,,,,,,,,,ChdDSUhNMG9nS0VJQ0FnSUREMmNpSDdRRRAB,,,,,,Google,,117958081581126936065,,,,,,,,,,,,,,,,
Wendy's,5,,2024-04-01T01:47:57.631Z,0,,9,TRUE,,,3 weeks ago,,Lunch,Plenty of parking,$1–10,,Dine in,5,5,5,ChZDSUhNMG9nS0VJQ0FnSUNEbzl6TGF3EAE,,,,,,Google,,109619837210432240661,,,,,,,,,,,,,,,,
Wendy's,5,"I come here almost all the time for lunch on the weekdays, and the lunch crew here are phenomenal. They are fast, friendly and courteous. Amazing customer service. All other Wendy's should take a page of this book, especially the one in Garner, smh.",2024-03-29T22:47:13.396Z,0,,12,FALSE,,,3 weeks ago,,,,,,,5,5,5,ChdDSUhNMG9nS0VJQ0FnSUNEcWZpM193RRAB,,,,,,Google,,112682738184784369035,,,,,,,,,,,,,,,,
Wendy's,4,"This location has been consistent.
Staff is pleasant.",2024-03-20T20:11:09.081Z,0,,54,TRUE,,,a month ago,,Lunch,,$1–10,,Dine in,3,3,4,ChZDSUhNMG9nS0VJQ0FnSUQ5c19HTEdBEAE,,,,,,Google,,115818504918813583062,,,,,,,,,,,,,,,,
Wendy's,5,,2024-03-20T18:33:03.371Z,0,,,FALSE,,,a month ago,,Lunch,,,,Take out,5,5,5,ChdDSUhNMG9nS0VJQ0FnSUQ5MF92UWt3RRAB,,,,,,Google,,117260377672008599533,,,,,,,,,,,,,,,,
Wendy's,2,The service sucked couldn't speak English double charged me claimed to have done cash back on the second order but couldn't get me the cash because there was no manager there which all was a lie looked at my account and it shows me charged for 2 of the items that I only got one of !!,2024-03-17T16:14:37.088Z,0,,14,TRUE,,,a month ago,,Lunch,,,,Take out,,3,1,ChdDSUhNMG9nS0VJQ0FnSUQ5b2EtMDZBRRAB,,,,,,Google,,115534750894871089210,,,,,,,,,,,,,,,,
Wendy's,1,Bathroon flooded nuggets tested like potatoes,2024-03-17T02:15:11.820Z,0,,7,FALSE,,,a month ago,,Dinner,,$10–20,,Take out,1,1,1,ChZDSUhNMG9nS0VJQ0FnSUQ5N3JXa0t3EAE,,,,,,Google,,107542889960100248705,,,,,,,,,,,,,,,,
Wendy's,5,"Very nice lady on the register ,walk me through how to use the app to get a special",2024-03-08T23:13:50.924Z,0,,91,TRUE,,,a month ago,,Lunch,,$1–10,,Dine in,5,5,5,ChdDSUhNMG9nS0VJQ0FnSUM5ZzdxRWpBRRAB,,,,,,Google,,117342582556236274480,,,,,,,,,,,,,,,,
Wendy's,2,,2024-03-07T16:55:01.097Z,0,,10,FALSE,,,a month ago,,Lunch,,,,Dine in,3,1,4,ChZDSUhNMG9nS0VJQ0FnSUM5cGFfZllBEAE,,,,,,Google,,118081950901082154652,,,,,,,,,,,,,,,,
Wendy's,5,"I am a Doordasher, just picking up from here tonight, and I gotta say in more than two years of delivering food, I think this was the first time a staff member has ever helped me take the food to my car!!! 🙏 I wish I had got his name, but the whole staff working here tonight deserves some praise! 11/10 and thank you so much!",2024-03-06T01:29:21.302Z,0,,22,FALSE,,,a month ago,,,,,,Take out,5,5,5,ChdDSUhNMG9nS0VJQ0FnSUM5M29ueXlRRRAB,,,,,,Google,,107011905901692361401,,,,,,,,,,,,,,,,
Wendy's,4,,2024-02-28T07:02:32.970Z,0,,,FALSE,,,a month ago,,,Plenty of parking,,,,3,4,5,ChdDSUhNMG9nS0VJQ0FnSURkNTZmQTlBRRAB,,,,,,Google,,115246175085470513787,,,,,,,,,,,,,,,,
Wendy's,1,They NEVER get the order right…..,2024-01-27T17:10:07.197Z,0,,22,TRUE,,,2 months ago,,Lunch,,$1–10,,Take out,,3,1,ChZDSUhNMG9nS0VJQ0FnSUROdjczRVV3EAE,,,,,,Google,,114560265461746037933,,,,,,,,,,,,,,,,
Wendy's,4,"Stopped by for a quick breakfast, and it was decent. There is a good amount of seating here, but hardly anyone in the store. The employees were friendly.",2024-01-27T15:41:52.916Z,0,,1068,TRUE,,,2 months ago,,Breakfast,Plenty of parking,$1–10,,Dine in,4,4,4,ChdDSUhNMG9nS0VJQ0FnSUROMzhPb3FRRRAB,https://lh5.googleusercontent.com/p/AF1QipMre16eHYfTG6682-ArOuiewk3p6f8L3gkqgvbT=w150-h150-k-no-p,https://lh5.googleusercontent.com/p/AF1QipNm6_JKyC3B_sNOIKM_ppwQhMDk2fklb7Vx0-ip=w150-h150-k-no-p,https://lh5.googleusercontent.com/p/AF1QipNzA_v-c7BAaaaoqcEckF2JSvmcUdQxvb0ggB3b=w150-h150-k-no-p,https://lh5.googleusercontent.com/p/AF1QipMHT7J_eq5qJq3d69DaD7KMTEjmujbxYMDSx0Fj=w150-h150-k-no-p,,Google,,112459269294153218090,,,,,,,,,,,,,,,,
Wendy's,5,Fast service,2024-01-23T22:38:43.353Z,0,,167,TRUE,,,2 months ago,,Lunch,,$1–10,,Take out,5,5,5,ChZDSUhNMG9nS0VJQ0FnSURObWN2RlF3EAE,,,,,,Google,,106438213527945022993,,,,,,,,,,,,,,,,
Wendy's,5,One of the best Wendy's I've been to. The people working here are great!,2024-01-17T17:32:04.899Z,0,,99,TRUE,,,3 months ago,,Lunch,,$10–20,,Dine in,5,5,5,ChdDSUhNMG9nS0VJQ0FnSURld3FURV93RRAB,,,,,,Google,,110605434400081751029,,,,,,,,,,,,,,,,
Lucky Chicken,2,,2024-04-17T00:13:49.664Z,0,,88,TRUE,,,6 days ago,,Dinner,,$20–30,Would not recommend,,2,2,2,ChdDSUhNMG9nS0VJQ0FnSUNqME11djFRRRAB,,,,,,Google,,114660720202096642252,,,,,,,,,,,,,,,,
Lucky Chicken,5,I was looking for a good Peruvian restaurant and this place popped up while I was in the area. As a Peruvian I'm actually shocked at some of the reviews on here. The seafood chaufa was delicious and the service was fantastic! I live an hour away and will be taking trips back to try the other items on the menu!,2024-04-16T19:18:47.600Z,0,,4,FALSE,,,a week ago,,Lunch,,$50–100,,Dine in,5,5,5,ChdDSUhNMG9nS0VJQ0FnSUNqNEtlcHh3RRAB,https://lh5.googleusercontent.com/p/AF1QipNCED8kXhxPWLlPmTGO0W12lccsR0EOQSYDNVgo=w150-h150-k-no-p,,,,,Google,,100809520530078450106,,,,,,,,,,,,,,,,
Lucky Chicken,5,Very good! First time trying this type of food and I am hooked.,2024-04-13T18:45:37.635Z,0,,16,TRUE,,,a week ago,,Lunch,,$20–30,,Dine in,5,5,5,ChZDSUhNMG9nS0VJQ0FnSURENDU2dk53EAE,,,,,,Google,,116992013890751626881,,,,,,,,,,,,,,,,
Lucky Chicken,5,"I usually eat at this restaurant every once in a while. I enjoy peruvian dishes and they captured the taste very accurately! It is a great place to try new fresh food. My food always comes in at the right temperature, the service is great and there is light music playing. The decorations are also elegant! Wonderful restaurant, I recommend it here!",2024-04-13T17:35:12.761Z,0,,5,FALSE,,,a week ago,,,,,,,5,5,5,ChdDSUhNMG9nS0VJQ0FnSUREby1fLXJnRRAB,https://lh5.googleusercontent.com/p/AF1QipNUEs4x3-twzzW0NhVjT11qLJIwT9-JdOU8WPuR=w150-h150-k-no-p,https://lh5.googleusercontent.com/p/AF1QipPb6aczch6qkPwVmOKaQb9C3s8sZUvVlEVeNwX_=w150-h150-k-no-p,,,,Google,,114039890799383732660,,,,,,,,,,,,,,,,
Lucky Chicken,5,"The food is wonderful, the service is friendly, the whole place is a delightful surprise! Can’t wait to come back to Cary so we try more of the delicious food. Try the Ceviche Mix or the Saltado de Pollo 🤩",2024-04-07T18:42:59.549Z,0,,43,TRUE,,,2 weeks ago,,Lunch,,$20–30,,Dine in,3,5,5,ChZDSUhNMG9nS0VJQ0FnSUREOHFteENnEAE,,,,,,Google,,106296252835227111910,,,,,,,,,,,,,,,,
Lucky Chicken,1,"90 DOLLARS FOR THIS OUTRAGEOUS EXPERIENCE!!! To begin with these prices were insane and for what, the food was not good at all. The chicken was very undercooked and the fish looked liked it was swimming in a deep frier. We ordered a SIDE of yucca fries and we got a whole entire dish made with yuca fries for about 9 dollars which isn’t what we ordered plus it tasted horrible. We then asked about it and the employee said,”I brought it out to your table so I added it to the bill,” even though we never ordered it. The whole experience was just not good and the food took way too long to come out. Overall I do NOT Recommend coming here.",2024-04-07T17:44:15.511Z,0,,1,FALSE,,,2 weeks ago,,Lunch,,$20–30,,Dine in,1,1,1,ChdDSUhNMG9nS0VJQ0FnSUREOHZEVm5BRRAB,,,,,,Google,,114655550973585829636,,,,,,,,,,,,,,,,
Lucky Chicken,4,"Very different food and favors from the usual fare. Definitely worth the somewhat higher prices. Not fast food, just good food.",2024-04-07T17:24:35.602Z,0,,9,FALSE,,,2 weeks ago,,,,,,Dine in,,,,ChZDSUhNMG9nS0VJQ0FnSUREc29lbU1REAE,,,,,,Google,,109667061993347487442,,,,,,,,,,,,,,,,
Lucky Chicken,5,We only got fish ceviche but it was amazing and authentic.,2024-04-06T23:49:49.862Z,0,,8,FALSE,,,2 weeks ago,,,,,,,4,5,4,ChdDSUhNMG9nS0VJQ0FnSUREdlBYcGhRRRAB,,,,,,Google,,107835017976614761804,,,,,,,,,,,,,,,,
Lucky Chicken,5,The food (Ceviche and Jalea) was espectacular!! Thanks so so much..,2024-04-06T21:46:20.897Z,0,,3,FALSE,,,2 weeks ago,,,,$30–50,,Take out,5,5,5,ChZDSUhNMG9nS0VJQ0FnSUREM0t1OUh3EAE,,,,,,Google,,108944381796189910602,,,,,,,,,,,,,,,,
Lucky Chicken,5,"The food was good, I had the mussels app and it was to die for, my fiance is vegetarian and loved the plantain dish and he Cleared his plate!
Overall really good. Yes, it can be alittle pricey for the seafood entrees, but if you think of it as a sitdown restaurant and not carry out, the cost is more reasonable.",2024-04-03T22:06:54.914Z,0,,42,TRUE,,,2 weeks ago,,,Plenty of parking,$10–20,Highly recommend,,5,5,5,ChZDSUhNMG9nS0VJQ0FnSUNEdjlUMlVBEAE,,,,,,Google,,111889066498301448712,,,,,,,,,,,,,,,,
Lucky Chicken,5,The food was delicious! We had what the owner recommended and loved it. Definitely worth eating here.,2024-03-29T23:45:58.827Z,0,,26,TRUE,,,3 weeks ago,,Dinner,,$10–20,,Dine in,5,5,5,ChZDSUhNMG9nS0VJQ0FnSUNEcWFIYVd3EAE,,,,,,Google,,102806538440152881362,,,,,,,,,,,,,,,,
Lucky Chicken,1,"If you wanna eat garbage or have a bad experience you should go to this restaurant because this has to be the worst restaurant that I've ever been I wonder if the ""chef"" knows what seasoning is or what it means because the only think that I could've taste was old grease I don't know how this place is allowed to be open. I regret spending my money on this garbage because I wasn't able to finish it so I threw it all to the trash.",2024-03-27T18:33:12.263Z,0,,1,FALSE,,,3 weeks ago,,,,,,,,,,ChdDSUhNMG9nS0VJQ0FnSUNENXNDUHhnRRAB,,,,,,Google,,117367394147530806368,,,,,,,,,,,,,,,,
Lucky Chicken,4,"The ceviche I had was good, perhaps on the slightly expensive side. Restaurant was small, seemed like more of a take-out place.",2024-03-25T12:19:56.683Z,0,,225,TRUE,,,4 weeks ago,,,,,,,3,4,4,ChdDSUhNMG9nS0VJQ0FnSUNEN0lMY2l3RRAB,,,,,,Google,,106766734655812394885,,,,,,,,,,,,,,,,
Lucky Chicken,5,First time after Easter bunny pictures at bass pro shops. We needed a quick easy family friendly place to take the baby… wow! Flavor town! We are so happy to have found an authentic taste and completely cleaned the chicken bones,2024-03-23T22:36:28.542Z,0,,3,FALSE,,,4 weeks ago,,Dinner,,$20–30,,Dine in,5,5,5,ChdDSUhNMG9nS0VJQ0FnSUNEcUliOGp3RRAB,,,,,,Google,,113183968665023553461,,,,,,,,,,,,,,,,
Lucky Chicken,5,The ceviche classic fish is excellent,2024-03-22T12:04:13.105Z,0,,1,FALSE,,,a month ago,,Lunch,,$20–30,,Dine in,5,5,5,ChdDSUhNMG9nS0VJQ0FnSUQ5ajdfVDNBRRAB,,,,,,Google,,100932291474115160572,,,,,,,,,,,,,,,,
Lucky 7,4,,2024-04-13T23:26:39.882Z,0,,1,FALSE,,,a week ago,,Dinner,,$1–10,,Take out,3,3,5,ChRDSUhNMG9nS0VJQ0FnSUREMDhwWRAB,,,,,,Google,,104576798068767029000,,,,,,,,,,,,,,,,
Lucky 7,5,I have been eating at this place for Almost 2 years now I love it !,2024-04-06T15:51:53.941Z,0,,2,FALSE,2024-04-06T15:57:43.347Z,,2 weeks ago,,,,,,,5,5,5,ChdDSUhNMG9nS0VJQ0FnSUREN0lqSHlRRRAB,,,,,,Google,,113314189365307137133,,,,,,,,,,,,,,,,
Lucky 7,5,"This is the best restaurant so far. The food is tasty, they serve very quick and they provide good atmosphere for dine in. I recommend this restaurant for the food and money. 😀",2024-04-03T23:23:30.824Z,0,,3,FALSE,,,2 weeks ago,,,,,,,5,5,5,ChZDSUhNMG9nS0VJQ0FnSUNEdjhuTktnEAE,,,,,,Google,,111729787132490460310,,,,,,,,,,,,,,,,
Lucky 7,5,PORK FRIED RICE IS MY FAVORITE!! Good Food & Good Service,2024-03-24T17:21:12.937Z,0,,2,FALSE,,,4 weeks ago,,Lunch,,$1–10,,Take out,5,5,5,ChdDSUhNMG9nS0VJQ0FnSUNENUlLVHZBRRAB,https://lh5.googleusercontent.com/p/AF1QipPJSX25uPMBjfjLQ4MY6HvBBkp2_7ADAsIsAToR=w150-h150-k-no-p,,,,,Google,,115815560290877762561,,,,,,,,,,,,,,,,
Lucky 7,5,"Crab Rangoon, egg rolls, and shrimp. Excellent flavor., Perfect temperature.",2024-03-22T00:39:45.125Z,0,,22,TRUE,2024-03-22T00:51:02.214Z,,a month ago,,Other,Plenty of parking,$10–20,,Take out,3,5,4,ChZDSUhNMG9nS0VJQ0FnSUQ5NTc2YUZBEAE,,,,,,Google,,100805713497955912208,,,,,,,,,,,,,,,,
Lucky 7,5,A restaurant where you have experienced good food,2024-03-21T14:51:14.626Z,1,,2,FALSE,,,a month ago,,Dinner,,$50–100,,Take out,5,5,5,ChdDSUhNMG9nS0VJQ0FnSURKeThTbHFnRRAB,,,,,,Google,,117822519573257420340,,,,,,,,,,,,,,,,
Lucky 7,5,Great food with wonderful service.,2024-03-21T00:06:36.449Z,0,,2,FALSE,,,a month ago,,Dinner,,,,Take out,5,5,5,ChdDSUhNMG9nS0VJQ0FnSUQ5aS1DaWp3RRAB,,,,,,Google,,111387113323531613422,,,,,,,,,,,,,,,,
Lucky 7,5,best Chinese food in Cary,2024-03-20T21:08:18.824Z,0,,1,FALSE,,,a month ago,,Dinner,,$10–20,,Take out,5,5,5,ChdDSUhNMG9nS0VJQ0FnSUQ5czdlT293RRAB,,,,,,Google,,117931882728015861900,,,,,,,,,,,,,,,,
Lucky 7,5,Love them always nice,2024-03-18T01:38:48.356Z,0,,1,FALSE,,,a month ago,,,,,,Take out,5,5,5,ChdDSUhNMG9nS0VJQ0FnSUQ5c1kzR19nRRAB,,,,,,Google,,101312269930151044562,,,,,,,,,,,,,,,,
Lucky 7,5,,2024-03-17T22:27:57.175Z,0,,,FALSE,2024-03-17T22:39:56.426Z,,a month ago,,Lunch,,$10–20,,Take out,5,5,5,ChdDSUhNMG9nS0VJQ0FnSUQ5MGJIYm5nRRAB,,,,,,Google,,115377939432552923225,,,,,,,,,,,,,,,,
Lucky 7,5,Awesome food!,2024-03-17T01:44:41.337Z,0,,1,FALSE,2024-03-17T22:40:13.747Z,,a month ago,,,,,,,5,5,5,ChdDSUhNMG9nS0VJQ0FnSUQ5N3U2TjBRRRAB,,,,,,Google,,105634748634255547240,,,,,,,,,,,,,,,,
Lucky 7,5,,2024-03-17T01:42:45.332Z,0,,,FALSE,2024-03-17T22:40:46.694Z,,a month ago,,,,,,,5,5,5,ChZDSUhNMG9nS0VJQ0FnSUQ5N3E2Z0N3EAE,,,,,,Google,,109889545741708438611,,,,,,,,,,,,,,,,
Lucky 7,5,,2024-03-16T22:45:02.000Z,0,,,FALSE,2024-03-17T22:41:11.832Z,,a month ago,,,,,,,5,5,5,ChdDSUhNMG9nS0VJQ0FnSUQ5cnRTWHFRRRAB,,,,,,Google,,118038527806007635616,,,,,,,,,,,,,,,,
Lucky 7,5,Love it!,2024-03-16T22:30:46.065Z,0,,1,FALSE,2024-03-17T22:41:33.758Z,,a month ago,,,,,,,,,,ChdDSUhNMG9nS0VJQ0FnSUQ5cnZDN2xBRRAB,,,,,,Google,,108889678586545758281,,,,,,,,,,,,,,,,
Lucky 7,5,Great spot for lunch or dinner! Staff warm and welcoming. The atmosphere is inviting and the food was delicious.  We had the bacon wrapped meatloaf and Cajun shrimp with truffle fries for our app. So so so good!!,2024-03-12T11:49:44.891Z,0,,142,TRUE,,,a month ago,,,,,,,5,5,5,ChdDSUhNMG9nS0VJQ0FnSUQ5MEttcmxnRRAB,,,,,,Google,,111004083698665177431,,,,,,,,,,,,,,,,
Taco Bell,4,"The service was great, and everyone was friendly, but my drink tasted funny, so I took the lid off and smelled it. It smelled like sour mop water. But everything else I ordered was great, fresh and hot.",2024-04-21T03:13:32.814Z,0,,64,TRUE,,,2 days ago,,Lunch,,$10–20,,Take out,5,3,5,ChZDSUhNMG9nS0VJQ0FnSUNqNW8zMEZREAE,,,,,,Google,,100823719858960077143,,,,,,,,,,,,,,,,
Taco Bell,1,Could taste mold/mildew in Fruit punch from soda fountain. Taco shells were stale. Very dissatisfied,2024-04-19T21:45:12.821Z,0,,2,FALSE,,,3 days ago,,Other,,$1–10,,Take out,3,1,3,ChdDSUhNMG9nS0VJQ0FnSUNqOG92WWtRRRAB,,,,,,Google,,108032318034693267175,,,,,,,,,,,,,,,,
Taco Bell,5,"I come here weekly and I'm not their only regular.  Even when I'm on a diet I just save most of my days calories so I can get my Taco Bell fix.  Order through the app and get great deals on food.  Love the friendly staff.  Look ""sometimes you wanna go where everybody knows your name!""",2024-04-04T20:53:43.936Z,0,,24,TRUE,,,2 weeks ago,,Lunch,,$1–10,,Take out,4,4,5,ChdDSUhNMG9nS0VJQ0FnSUREaUpLdXh3RRAB,,,,,,Google,,113017963569165856609,,,,,,,,,,,,,,,,
Taco Bell,5,,2024-04-02T19:27:00.038Z,0,,1,FALSE,,,3 weeks ago,,,,,,,5,5,5,ChdDSUhNMG9nS0VJQ0FnSUNENTltaTBnRRAB,,,,,,Google,,116537652480723670835,,,,,,,,,,,,,,,,
Taco Bell,5,Soft Taco supreme's are not what they used to be and made very sloppy and cold. Prep person needs to be trained.,2024-03-18T17:53:57.412Z,1,,167,TRUE,,,a month ago,,Lunch,,$1–10,,Take out,,1,3,ChdDSUhNMG9nS0VJQ0FnSUR5bVp1WG9BRRAB,,,,,,Google,,106438213527945022993,,,,,,,,,,,,,,,,
Taco Bell,4,,2024-03-18T16:23:09.940Z,0,,97,TRUE,,,a month ago,,,,,,,,,,ChdDSUhNMG9nS0VJQ0FnSUQ5MmZ5YnNBRRAB,,,,,,Google,,117703622599905742645,,,,,,,,,,,,,,,,
Taco Bell,1,I love taco bell but this is the slowest taco bell ive ever been to and its been this way since covid.,2024-01-27T19:02:37.341Z,0,,4,FALSE,,,2 months ago,,,,,,,1,3,1,ChZDSUhNMG9nS0VJQ0FnSUN0Z1BEZEpBEAE,,,,,,Google,,107362833597813571659,,,,,,,,,,,,,,,,
Taco Bell,4,Bueno,2024-01-23T13:29:21.349Z,0,,48,TRUE,,,3 months ago,,,,,,,5,4,4,ChdDSUhNMG9nS0VJQ0FnSUROOGIzbXhRRRAB,,,,,,Google,,103768875328501292062,,,Well,,,,,,,,,,,,,
Taco Bell,5,Toca Bell and KFC under one roof how can you go wrong...,2024-01-17T23:55:17.408Z,0,,125,TRUE,,,3 months ago,,Lunch,,$10–20,,Dine in,5,5,5,ChdDSUhNMG9nS0VJQ0FnSUNOcTZUTWd3RRAB,,,,,,Google,,105732804928991518812,,,,,,,,,,,,,,,,
Taco Bell,5,Really good. Great service. No line.,2024-01-13T17:34:27.360Z,0,,117,TRUE,,,3 months ago,,Lunch,,$10–20,,Take out,5,5,5,ChZDSUhNMG9nS0VJQ0FnSUNONnF5OGZBEAE,,,,,,Google,,103508856828378010001,,,,,,,,,,,,,,,,
Taco Bell,5,When we go to North we always end up in this Taco Bell. It’s fresh food and taste perfect. Awesome food and very well maintained,2023-12-31T14:32:18.979Z,0,,148,TRUE,,,3 months ago,,Brunch,,$1–10,,Dine in,5,5,5,ChZDSUhNMG9nS0VJQ0FnSUMxMGYzclZREAE,,,,,,Google,,100474246543284085260,,,,,,,,,,,,,,,,
Taco Bell,5,Had a great  experience  and the service was fast and friendly,2023-12-23T14:08:45.863Z,0,,21,FALSE,,,4 months ago,,Lunch,,$10–20,Highly recommend,Dine in,,,,ChdDSUhNMG9nS0VJQ0FnSUMxMU9pcHRnRRAB,,,,,,Google,,116179124437319744309,,,,,,,,,,,,,,,,
Taco Bell,3,,2023-12-21T02:49:34.359Z,0,,,FALSE,,,4 months ago,,,,,,,,,,ChdDSUhNMG9nS0VJQ0FnSUMxc0ltUnNBRRAB,,,,,,Google,,108955513267557544359,,,,,,,,,,,,,,,,
Taco Bell,3,,2023-12-19T15:13:11.702Z,0,,,FALSE,,,4 months ago,,,,,,,2,4,5,ChdDSUhNMG9nS0VJQ0FnSURwXzhpVGdBRRAB,,,,,,Google,,115268459958331950437,,,,,,,,,,,,,,,,
Taco Bell,3,Food was ok. I had to ask again at the window for my condiments and then they forgot to give me my drink had to request that too.,2023-12-14T01:53:43.999Z,0,,233,TRUE,,,4 months ago,,Dinner,Plenty of parking,$1–10,,Take out,5,3,3,ChZDSUhNMG9nS0VJQ0FnSURWMlp2akRREAE,,,,,,Google,,117708592107385555353,,,,,,,,,,,,,,,,
Dame's Chicken & Waffles,5,First time in the place. Enjoyed myself with family. Will come back when in North Carolina.,2024-04-23T12:44:09.103Z,0,,139,TRUE,,,7 hours ago,,Lunch,,$20–30,,Dine in,5,5,5,ChZDSUhNMG9nS0VJQ0FnSUNqbVpHbkl3EAE,,,,,,Google,,105515154579746699630,,,,,,,,,,,,,,,,
Dame's Chicken & Waffles,4,"The chicken wings were old, I was disappointed this time visiting the restaurant.",2024-04-23T12:18:25.330Z,0,,284,TRUE,,,7 hours ago,,Lunch,,$10–20,,Dine in,4,4,4,ChZDSUhNMG9nS0VJQ0FnSUNqbWNLZ013EAE,,,,,,Google,,115196765666816614486,,,,,,,,,,,,,,,,
Dame's Chicken & Waffles,5,"This was my first visit here.
The service was wonderful.
I really enjoyed my food.
I'll probably return.",2024-04-21T12:34:01.381Z,0,,185,TRUE,,,2 days ago,,Lunch,,$20–30,,Dine in,5,5,5,ChdDSUhNMG9nS0VJQ0FnSUNqOXViZjhnRRAB,,,,,,Google,,102220251122801526089,,,,,,,,,,,,,,,,
Dame's Chicken & Waffles,5,Got the basic chicken and waffles.  Fried chicken pieces were fried perfectly and seasoned nicely.  Waffles were prepared nicely and the “schmear” and sauce brought out the best in both of the above.  Enjoyed very much!,2024-04-19T18:22:10.584Z,0,,4,FALSE,,,4 days ago,,Breakfast,,$10–20,,Dine in,4,5,5,ChZDSUhNMG9nS0VJQ0FnSUNqc3BxYVd3EAE,,,,,,Google,,107910366125121613865,,,,,,,,,,,,,,,,
