title,stars,text,publishedAtDate,likesCount,name,reviewerNumberOfReviews,isLocalGuide,responseFromOwnerDate,responseFromOwnerText,publishAt,rating,reviewContext/Meal type,reviewContext/Parking space,reviewContext/Price per person,reviewContext/Recommendation for vegetarians,reviewContext/Service,reviewDetailedRating/Atmosphere,reviewDetailedRating/Food,reviewDetailedRating/Service,reviewId,reviewImageUrls/0,reviewImageUrls/1,reviewImageUrls/2,reviewImageUrls/3,reviewImageUrls/4,reviewOrigin,reviewUrl,reviewerId,reviewerPhotoUrl,reviewerUrl,textTranslated,reviewContext/Parking type options,reviewImageUrls/5,reviewImageUrls/6,reviewImageUrls/7,reviewImageUrls/8,reviewImageUrls/9,reviewImageUrls/10,reviewImageUrls/11,reviewImageUrls/12,reviewImageUrls/13,reviewImageUrls/14,reviewImageUrls/15,reviewImageUrls/16
Bojangles,5,"Best Bojangles I have ever been to! I was even missing an item from my order and staff was very nice and replaced the item.
Restaurant was super cleaned and staff were very attentive to keeping it looking good!",2024-04-19T17:58:02.976Z,0,,4,FALSE,,,4 days ago,,,,,,,5,5,5,ChZDSUhNMG9nS0VJQ0FnSUNqc3JTNlF3EAE,,,,,,Google,,112729586645752173914,,,,,,,,,,,,,,,,
Bojangles,1,"Poor manners
Just slammed down the food that came out",2024-04-17T00:09:17.475Z,0,,1,FALSE,,,6 days ago,,,,,,Dine in,1,1,1,ChZDSUhNMG9nS0VJQ0FnSUNqMFB1cEFnEAE,,,,,,Google,,106004920073655889682,,,,,,,,,,,,,,,,
Bojangles,5,,2024-04-16T15:22:19.444Z,0,,28,TRUE,2024-04-16T15:45:39.597Z,,a week ago,,Lunch,,$10–20,,Take out,5,5,5,ChZDSUhNMG9nS0VJQ0FnSUNqd0pQbFZ3EAE,,,,,,Google,,103687305101319640543,,,,,,,,,,,,,,,,
Bojangles,5,,2024-04-13T13:12:44.629Z,0,,57,TRUE,2024-04-13T13:23:20.448Z,,a week ago,,Breakfast,,$1–10,Somewhat recommend,Take out,5,5,5,ChZDSUhNMG9nS0VJQ0FnSUREZzV2RmNREAE,,,,,,Google,,116858187946386399636,,,,,,,,,,,,,,,,
Bojangles,5,,2024-04-12T01:06:19.511Z,0,,7,TRUE,2024-04-12T01:12:36.543Z,,a week ago,,Lunch,,$10–20,,Take out,,,,ChZDSUhNMG9nS0VJQ0FnSUREeGNLdVpBEAE,,,,,,Google,,101489291322686509953,,,,,,,,,,,,,,,,
Bojangles,1,"Good food, customer interaction/service is 0/5. They will actively insult you.
EMS beware, they will refuse you.",2024-04-12T01:02:04.615Z,0,,47,FALSE,,,a week ago,,,,,,,,,,ChZDSUhNMG9nS0VJQ0FnSURlLW9EX0lBEAE,,,,,,Google,,115950674343491801312,,,,,,,,,,,,,,,,
Bojangles,5,Stopped for breakfast and went through the drive-thru. I got through the line quickly and the staff were friendly! My food was as ordered.,2024-04-06T15:14:43.287Z,0,,122,TRUE,,,2 weeks ago,,Breakfast,,$1–10,,Take out,5,5,5,ChdDSUhNMG9nS0VJQ0FnSUREckl2RmpRRRAB,,,,,,Google,,109958062497509671530,,,,,,,,,,,,,,,,
Bojangles,4,Staff was unbelievable. They were incredibly friendly.  Food was great too! Bojangles is definitely my favorite fast food fried chicken ☺️,2024-04-05T18:45:25.411Z,0,,26,TRUE,,,2 weeks ago,,,,,,,3,4,5,ChdDSUhNMG9nS0VJQ0FnSUREeExmSXB3RRAB,,,,,,Google,,110979797250725207080,,,,,,,,,,,,,,,,
Bojangles,5,4-4-24. Great staff,2024-04-05T13:28:03.315Z,0,,74,FALSE,,,2 weeks ago,,,,,,,5,5,5,ChZDSUhNMG9nS0VJQ0FnSURELUpyLUN3EAE,,,,,,Google,,109960571616119212053,,,,,,,,,,,,,,,,
Bojangles,5,The service was quick and friendly and my food was hot. I'm not sure what more you could expect from a Bojangles but I'm very happy. The next time I'm in that area and it's lunch time I know I will be coming back for more of that delicious food.,2024-03-25T17:51:15.108Z,0,,708,TRUE,2024-03-20T11:34:36.940Z,,4 weeks ago,,Lunch,,$10–20,,Take out,5,5,5,ChZDSUhNMG9nS0VJQ0FnSUQ5Z19uSkJREAE,,,,,,Google,,113982589283279047042,,,,,,,,,,,,,,,,
Bojangles,1,,2024-03-20T14:00:56.030Z,0,,,FALSE,2024-03-20T14:11:29.640Z,,a month ago,,Breakfast,,$1–10,,Take out,,,,ChZDSUhNMG9nS0VJQ0FnSUQ5bzZEYlJ3EAE,,,,,,Google,,111158330611767606220,,,,,,,,,,,,,,,,
Bojangles,5,Food fresh and hot,2024-03-19T13:24:55.013Z,0,,17,TRUE,,,a month ago,,Lunch,,$10–20,,Take out,5,5,5,ChdDSUhNMG9nS0VJQ0FnSUQ5dGFxMGpBRRAB,,,,,,Google,,115364164021026935106,,,,,,,,,,,,,,,,
Bojangles,5,,2024-03-16T21:26:35.771Z,0,,20,FALSE,2024-03-16T21:42:41.956Z,,a month ago,,,,,,,4,4,4,ChdDSUhNMG9nS0VJQ0FnSUQ5enZHX3BBRRAB,,,,,,Google,,118134250638212806633,,,,,,,,,,,,,,,,
Bojangles,1,By far the WORST Bojangles I have ever been to! They always get my order wrong and forget my sauce… I won’t be going back and I don’t recommend anyone else going here either!!,2024-03-12T21:44:57.784Z,0,,11,FALSE,,,a month ago,,,,,,,,,,ChdDSUhNMG9nS0VJQ0FnSUQ5Nk1uMHZnRRAB,,,,,,Google,,118390550208270640925,,,,,,,,,,,,,,,,
Kebab Skewer,4,,2024-04-21T22:09:29.821Z,0,,106,TRUE,,,a day ago,,Dinner,,$10–20,,Dine in,4,4,4,ChZDSUhNMG9nS0VJQ0FnSUNqN3I3MVBBEAE,,,,,,Google,,110549583547978488950,,,,,,,,,,,,,,,,
Kebab Skewer,5,We had lunch here for four people. We ordered kabob wraps and kabob platters. The food was great with a touch of authentic middle eastern.,2024-04-13T23:43:15.039Z,0,,64,TRUE,,,a week ago,,,,$10–20,,,5,5,5,ChZDSUhNMG9nS0VJQ0FnSUREMDlhR0VnEAE,,,,,,Google,,115130215886070303798,,,,,,,,,,,,,,,,
Kebab Skewer,5,,2024-04-04T18:28:17.827Z,0,,4,FALSE,,,2 weeks ago,,,,,,,5,5,5,ChdDSUhNMG9nS0VJQ0FnSUREOEt6eHZBRRAB,,,,,,Google,,105948507760351833383,,,,,,,,,,,,,,,,
Kebab Skewer,5,,2024-04-02T11:25:08.464Z,0,,6,FALSE,,,3 weeks ago,,Dinner,,$10–20,,Take out,,5,5,ChdDSUhNMG9nS0VJQ0FnSUNELTQtWjVnRRAB,,,,,,Google,,106384412204395642025,,,,,,,,,,,,,,,,
Kebab Skewer,5,"Any food item here is always awesome, it has become our go-to Kebab place.",2024-03-28T12:17:59.921Z,0,,32,TRUE,,,3 weeks ago,,Dinner,,,,Take out,4,5,5,ChZDSUhNMG9nS0VJQ0FnSUNEcnFXak93EAE,,,,,,Google,,104350546780231341309,,,,,,,,,,,,,,,,
Kebab Skewer,5,"It's a wonderful thing when an original plan falls through and you gamble on an unknown restaurant. I took that gamble and won. The food was amazing, the staff was wonderful. Everyone was inviting. I will return!",2024-03-25T14:21:09.925Z,0,,66,TRUE,,,4 weeks ago,,Lunch,,$10–20,,Dine in,5,5,5,ChdDSUhNMG9nS0VJQ0FnSUM5dl9XcHBRRRAB,,,,,,Google,,103117795614548662736,,,,,,,,,,,,,,,,
Kebab Skewer,5,"This s a small very basic kebab & gyro restaurant with walk up service no table service but super delicious. The food is totally yummy, very tasty.  I drove 20 minutes out of my way just to go there  & everything was worth it.  The prices are reasonable & you get  a nice size portion.",2024-03-23T12:31:52.598Z,0,,176,TRUE,,,a month ago,,Dinner,Difficult to find parking,$10–20,,Dine in,4,5,5,ChdDSUhNMG9nS0VJQ0FnSUNEa01fbC13RRAB,,,,,,Google,,112672906067148282824,,,,,,,,,,,,,,,,
Kebab Skewer,5,,2024-03-21T17:25:48.327Z,0,,,FALSE,,,a month ago,,,,,,,,,,ChdDSUhNMG9nS0VJQ0FnSUQ5aC15ZnNnRRAB,,,,,,Google,,100151375839402070679,,,,,,,,,,,,,,,,
Kebab Skewer,5,Top tier lamb kebab! Would come back,2024-03-15T15:55:44.363Z,0,,21,FALSE,,,a month ago,,,,,,,,,,ChdDSUhNMG9nS0VJQ0FnSUQ5bXFIQ3RnRRAB,,,,,,Google,,109686543382892108530,,,,,,,,,,,,,,,,
Kebab Skewer,3,,2024-03-02T16:08:32.165Z,0,,67,TRUE,,,a month ago,,Dinner,,$20–30,,Delivery,,,,ChZDSUhNMG9nS0VJQ0FnSUM5bE9UUWNREAE,,,,,,Google,,104634655389497235487,,,,,,,,,,,,,,,,
Kebab Skewer,5,"Excellent food, fresh and authentic.",2024-02-28T17:21:19.465Z,0,,55,TRUE,,,a month ago,,Dinner,,$10–20,,Dine in,3,5,5,ChZDSUhNMG9nS0VJQ0FnSURkcjUza0RREAE,,,,,,Google,,107499210581270795410,,,,,,,,,,,,,,,,
Kebab Skewer,5,The chicken shawarma was delicious! I highly recommend this place,2024-02-26T04:31:18.261Z,0,,7,FALSE,,,a month ago,,Dinner,,$10–20,,Dine in,5,5,5,ChdDSUhNMG9nS0VJQ0FnSUN0b0w3eDFBRRAB,,,,,,Google,,115759028352750136194,,,,,,,,,,,,,,,,
Kebab Skewer,5,,2024-02-19T23:07:44.897Z,0,,129,TRUE,,,2 months ago,,Lunch,,$10–20,,Dine in,5,5,5,ChZDSUhNMG9nS0VJQ0FnSUNkXzQyWVlBEAE,,,,,,Google,,117137537429032500146,,,,,,,,,,,,,,,,
Kebab Skewer,5,"I’m obsessed with this place, it is my go-to comfort food! The babaganoosh is out of this world, and the spicy chicken schwarma wrap is so delicious. My friend loves the gyro platter with rice and the TAZIKI SAUCEEEE!!! Also they’re very helpful if you have menu questions, such an amazing little spot!! :)",2024-02-10T20:31:34.735Z,0,,3,FALSE,,,2 months ago,,Lunch,,$10–20,,Take out,5,5,5,ChdDSUhNMG9nS0VJQ0FnSUNkeU5lTjVnRRAB,,,,,,Google,,111658301220455189642,,,,,,,,,,,,,,,,
Kebab Skewer,5,Always delicious. Quick service and always fresh. This place has replaced all out other kebab based choices.,2024-01-17T23:29:18.236Z,0,,49,TRUE,,,3 months ago,,Dinner,,$10–20,,Dine in,5,5,5,ChZDSUhNMG9nS0VJQ0FnSUNOeTgtdGVBEAE,,,,,,Google,,108565490251993916495,,,,,,,,,,,,,,,,
BJ's Restaurant & Brewhouse,5,Great lunch place! Salad was incredible,2024-04-20T15:31:49.358Z,0,,21,TRUE,2024-04-20T20:15:57.454Z,,3 days ago,,Lunch,,$10–20,,Dine in,4,5,4,ChZDSUhNMG9nS0VJQ0FnSUNqLXFUVFB3EAE,https://lh5.googleusercontent.com/p/AF1QipN2u1BvFnNZNhI0HqpOtAg8yZPsp1SWaA1rtt0y=w150-h150-k-no-p,,,,,Google,,115318575335396258018,,,,,,,,,,,,,,,,
BJ's Restaurant & Brewhouse,3,"What's Happened to BJ Brewhouse. The food was not what it use to be. We ordered a butterflies sirloin steak -- looked like the steak had been cooked in the microwave.   Also had the Smokehouse burger requested medium rare. Came out twice well down
Quality of burger not good.  Overall experience was definitely not up to par.",2024-04-15T18:01:14.032Z,1,,4,FALSE,2024-04-16T13:34:35.592Z,,a week ago,,Dinner,,$20–30,,Dine in,4,2,3,ChdDSUhNMG9nS0VJQ0FnSUREai1xeWx3RRAB,,,,,,Google,,117050800696513559676,,,,,,,,,,,,,,,,
BJ's Restaurant & Brewhouse,5,Allie was fantastic! The best waitress!,2024-04-13T00:27:15.658Z,0,,1,FALSE,2024-04-13T16:20:59.762Z,,a week ago,,Dinner,,,,Dine in,5,4,5,ChZDSUhNMG9nS0VJQ0FnSUREN2NHWmVREAE,,,,,,Google,,116760164773080504284,,,,,,,,,,,,,,,,
BJ's Restaurant & Brewhouse,1,,2024-04-11T02:10:11.090Z,0,,29,TRUE,2024-04-11T03:21:49.968Z,,a week ago,,,,,,,1,1,1,ChdDSUhNMG9nS0VJQ0FnSUREc1lPYnBBRRAB,,,,,,Google,,100648036042110530055,,,,,,,,,,,,,,,,
BJ's Restaurant & Brewhouse,5,It's a great place to enjoy a meal. A wide food and beverage selection. Our service was outstanding. Easy to locate with plenty of parking.,2024-04-08T03:15:40.258Z,0,,942,TRUE,2024-04-08T11:12:56.804Z,,2 weeks ago,,Dinner,,$20–30,,Dine in,5,5,5,ChdDSUhNMG9nS0VJQ0FnSURENnRUOTJRRRAB,,,,,,Google,,109782181727316177124,,,,,,,,,,,,,,,,
BJ's Restaurant & Brewhouse,1,$9.95 for one Red Oak pint is robbery. Go to Craft Public House up the road for better food and service.,2024-04-07T20:14:29.792Z,1,,6,FALSE,2024-04-08T16:23:26.469Z,,2 weeks ago,,Dinner,,$30–50,,Dine in,,,,ChdDSUhNMG9nS0VJQ0FnSUREaW9yZjRBRRAB,,,,,,Google,,104303120129020487983,,,,,,,,,,,,,,,,
BJ's Restaurant & Brewhouse,4,,2024-04-06T18:47:12.877Z,0,,3,FALSE,2024-04-06T19:21:24.209Z,,2 weeks ago,,Lunch,,$10–20,,Dine in,4,4,5,ChdDSUhNMG9nS0VJQ0FnSUREbko3Rmx3RRAB,,,,,,Google,,103875082073348399513,,,,,,,,,,,,,,,,
BJ's Restaurant & Brewhouse,5,Maddi is very attentive and anticipated my every need. You need you hire 5 Maddi's and your restaurant will flourish. Everything was great!,2024-04-06T18:19:01.785Z,0,,4,FALSE,2024-04-08T19:22:26.544Z,,2 weeks ago,,,,,,,5,5,5,ChZDSUhNMG9nS0VJQ0FnSUREbk1MVUtREAE,,,,,,Google,,100590486781639545932,,,,,,,,,,,,,,,,
BJ's Restaurant & Brewhouse,5,Madi had a wonderful personality and was really sweet. Loved my experience!!,2024-04-06T18:16:16.889Z,0,,5,FALSE,2024-04-08T19:22:45.123Z,,2 weeks ago,,,,,,,5,5,5,ChdDSUhNMG9nS0VJQ0FnSUREbkx5Vzd3RRAB,,,,,,Google,,113751360486070351916,,,,,,,,,,,,,,,,
BJ's Restaurant & Brewhouse,5,Madison was amazing!! Great personality and very helpful!,2024-04-06T16:52:45.958Z,0,,1,FALSE,2024-04-09T12:31:32.112Z,,2 weeks ago,,Lunch,,$10–20,,Dine in,5,5,5,ChZDSUhNMG9nS0VJQ0FnSUREN01tU0x3EAE,,,,,,Google,,115511229968045888328,,,,,,,,,,,,,,,,
BJ's Restaurant & Brewhouse,5,,2024-03-31T23:43:01.035Z,0,,,FALSE,2024-04-01T00:21:36.273Z,,3 weeks ago,,Dinner,,$30–50,Would not recommend,Dine in,5,4,5,ChZDSUhNMG9nS0VJQ0FnSUNEdzVMZ1F3EAE,,,,,,Google,,107050856388912784526,,,,,,,,,,,,,,,,
BJ's Restaurant & Brewhouse,5,Alexandra was an amazing server! Food was amazing! We had items that were recommended to us by a former employee and everything was spot on!,2024-03-31T02:26:30.289Z,0,,1,FALSE,2024-03-31T06:42:39.952Z,,3 weeks ago,,Dinner,,,,Dine in,5,5,5,ChdDSUhNMG9nS0VJQ0FnSUNEOWNHaHFBRRAB,,,,,,Google,,108482233292147446185,,,,,,,,,,,,,,,,
BJ's Restaurant & Brewhouse,5,"Brandi is our favorite server! Every time we come, we ask to sit with her. Shanna the host was also so friendly and hospitable. The Sriracha Brussel Sprouts are crispy, full of flavor, and are the first thing we order.",2024-03-31T01:24:08.828Z,0,,44,TRUE,2024-03-31T07:16:48.856Z,,3 weeks ago,,Dinner,,$50–100,,Dine in,5,5,4,ChdDSUhNMG9nS0VJQ0FnSUNEOWFqcDdRRRAB,,,,,,Google,,108694979248482258116,,,,,,,,,,,,,,,,
BJ's Restaurant & Brewhouse,5,I love coming to BJ's!!! The food is great and the service is top tier. Make sure to ask for Allie on your next visit!!!,2024-03-31T01:17:58.466Z,0,,1,FALSE,2024-03-31T07:20:05.397Z,,3 weeks ago,,Dinner,,$100+,,Dine in,5,5,5,ChZDSUhNMG9nS0VJQ0FnSUNEOWRDbmJBEAE,,,,,,Google,,108145473639623647999,,,,,,,,,,,,,,,,
BJ's Restaurant & Brewhouse,5,ALLIE IS THE BEST!! Great spirit and on point with all service needed. BJ’s never disappoints.,2024-03-31T01:17:21.392Z,0,,1,FALSE,2024-03-31T07:20:29.862Z,,3 weeks ago,,Dinner,,$30–50,,Dine in,5,5,5,ChdDSUhNMG9nS0VJQ0FnSUNEOWRDdThnRRAB,,,,,,Google,,108624022357278659255,,,,,,,,,,,,,,,,
Enrigo Italian Bistro,5,,2024-04-20T18:10:42.916Z,0,,280,TRUE,,,3 days ago,,Lunch,,$20–30,,Dine in,5,5,5,ChdDSUhNMG9nS0VJQ0FnSUNqaHNxUnN3RRAB,,,,,,Google,,112463874714647580256,,,,,,,,,,,,,,,,
Enrigo Italian Bistro,5,"Great food delicious 😋!

Great atmosphere and service.

This is a great Italian restaurant to try.",2024-04-20T01:44:25.881Z,0,,215,TRUE,,,3 days ago,,Lunch,,$50–100,,Dine in,5,5,5,ChdDSUhNMG9nS0VJQ0FnSUNqeXNyOTRBRRAB,https://lh5.googleusercontent.com/p/AF1QipPXADskSu_jAl7kEurVTB1BTpD7FzCc50ODchm2=w150-h150-k-no-p,https://lh5.googleusercontent.com/p/AF1QipNZe2taMAb9Xirdvs9O9-4yvcbzbMus5xJuurof=w150-h150-k-no-p,,,,Google,,108684284176700785748,,,,,,,,,,,,,,,,
Enrigo Italian Bistro,5,Jenna at the bar is amazing! We love the food here but customer service is top notch and keeps us coming back!,2024-04-13T23:15:02.986Z,0,,15,FALSE,,,a week ago,,Dinner,,$10–20,,Take out,5,5,5,ChZDSUhNMG9nS0VJQ0FnSUREMDd5aGZ3EAE,,,,,,Google,,111046962911988113593,,,,,,,,,,,,,,,,
Enrigo Italian Bistro,5,"The best Italian ristorante in town, great food, natural ingredients, with the great attendance personal, highly recommended",2024-04-10T02:58:38.116Z,0,,584,TRUE,,,a week ago,,Lunch,,$30–50,,Dine in,5,5,5,ChdDSUhNMG9nS0VJQ0FnSUREdnBqRl9BRRAB,,,,,,Google,,110307545223631662966,,,,,,,,,,,,,,,,
Enrigo Italian Bistro,5,I can't tell you the last time I ate my entire plate and felt so good about it. Hands down the best damn Italian food in the triangle area 😋,2024-04-06T02:18:30.110Z,0,,9,FALSE,,,2 weeks ago,,,,,,Take out,5,5,5,ChdDSUhNMG9nS0VJQ0FnSUREbE9fUHlnRRAB,https://lh5.googleusercontent.com/p/AF1QipP-GOdro_px4gh1VgWPCSh13siDAuMX24AV6hiP=w150-h150-k-no-p,,,,,Google,,114152736643805030399,,,,,,,,,,,,,,,,
Enrigo Italian Bistro,5,Fantastic restaurant. Wonderful food & excellent service,2024-04-06T00:43:00.400Z,0,,6,TRUE,,,2 weeks ago,,Dinner,,$20–30,,,4,5,5,ChdDSUhNMG9nS0VJQ0FnSUREbE1hcXRRRRAB,,,,,,Google,,106221818397415652005,,,,,,,,,,,,,,,,
Enrigo Italian Bistro,5,"We have loved Enrigos for a long time but - wow!  We went there for a belated birthday with some out of town guests last night and -(did I say) wow! The service was warm, welcoming, and simply better than any we've experienced anywhere.  They greeted us with wine, the appetizers were terrific, dinner was perfect. Smiles all the way around from everyone. It felt like such a special night. We'll be back.",2024-04-05T15:12:22.930Z,0,,1,FALSE,,,2 weeks ago,,Dinner,,$20–30,,,5,5,5,ChZDSUhNMG9nS0VJQ0FnSUREaFBqc1hnEAE,https://lh5.googleusercontent.com/p/AF1QipOGO84mtL9ywDI5nvoY3_At2xfM8HAIf9VINrbD=w150-h150-k-no-p,https://lh5.googleusercontent.com/p/AF1QipOxLPlD__6h-OgZCWlvxcl_qSfEu2tiYVKms2or=w150-h150-k-no-p,https://lh5.googleusercontent.com/p/AF1QipProV5mxgxGOJQcd-DRkB41vHqPdc2QPQpsv9rw=w150-h150-k-no-p,,,Google,,101280560661206181992,,,,,,,,,,,,,,,,
Enrigo Italian Bistro,5,Ordered a lemon. Received a lemon,2024-04-03T16:22:00.804Z,0,,2,FALSE,,,2 weeks ago,,Dinner,,$20–30,,Dine in,5,5,5,ChZDSUhNMG9nS0VJQ0FnSUNENy1PSEx3EAE,,,,,,Google,,108897419283543035211,,,,,,,,,,,,,,,,
Enrigo Italian Bistro,4,Great place to hang out with friends and family. They serve you a welcome drink and dessert which is delicious. I enjoyed the hospitality more than my entree.,2024-04-02T12:12:13.060Z,0,,80,TRUE,,,3 weeks ago,,,,,,,5,4,5,ChZDSUhNMG9nS0VJQ0FnSUNEaDdTRlpnEAE,,,,,,Google,,101088835591093541132,,,,,,,,,,,,,,,,
Enrigo Italian Bistro,5,,2024-03-31T19:58:38.585Z,0,,23,TRUE,,,3 weeks ago,,Lunch,,$30–50,,Dine in,5,5,5,ChZDSUhNMG9nS0VJQ0FnSUNEX2FXekxnEAE,,,,,,Google,,107129269787541746853,,,,,,,,,,,,,,,,
Enrigo Italian Bistro,1,"We have eaten here many times since it opened. We had guests in from out of town and it was a perfect place to meet. Mason our server was the only good thing about the night. Our Caesar salad had absolutely no taste at all. Followed by a chicken parm that was pounded so thin and fried we had to ask for a steak knife to cut it. At $26for chicken parm I do not think it was even an entire chicken breast. There was nothing moist or juicy in this entree at all. Also ordered was a maybe 2 inch by 3 inch piece of eggplant parm for $24. The veggies it came with were good. Clearly the portions have gone down and the prices have gone up. Our guests did not finish their food and I believe were just being polite in not saying it was not good. To top it off on the bill they added a non cash adjustment for using a credit card!! All I can say is with all the Italian restaurants in the area that are far superior, more affordable and better quality we will never return!",2024-03-27T12:28:26.540Z,0,,7,FALSE,,,3 weeks ago,,Dinner,,$100+,,Dine in,3,1,4,ChdDSUhNMG9nS0VJQ0FnSUNEaHNUM2hRRRAB,,,,,,Google,,117003664079476812699,,,,,,,,,,,,,,,,
Enrigo Italian Bistro,5,"Had such a pleasant experience, the Cesar salad was amazing,  so was the fresh bread. The chef Tagliolini was so good too, got it with shrimp and extra sauce. My husband got one of the pizzas and that was great too! We will definitely be back. The owner even came and checked on us, that's always a plus.",2024-03-21T00:28:34.233Z,0,,61,TRUE,,,a month ago,,Dinner,,$30–50,,Dine in,5,5,3,ChdDSUhNMG9nS0VJQ0FnSUQ5aS1Ud3V3RRAB,,,,,,Google,,106137698571834323462,,,,,,,,,,,,,,,,
Enrigo Italian Bistro,5,Honestly I don't even know where to start. There aren't enough wonderful words to describe this authentic Italian restaurant. My husband and I love traveling and trying different cuisines and restaurants. I have to say in all my life I have never been to a place where I was more impressed with the staff than anything else. Don't get me wrong the food was AMAZING but the staff were so warm and welcoming. We truly felt like we were part of the family. I seriously thought they seated us and mistook us for a different family with a reservation because of how accommodating and attentive they were. We live 4 hours away but will absolutely be returning every time we are in the area! I've already told others about this wonderful place and they are looking forward to going. The smile on my son's face shows just how happy we all were. Thank you for such a perfect experience!,2024-03-19T02:09:57.448Z,0,,81,TRUE,,,a month ago,,,,,,,5,5,5,ChZDSUhNMG9nS0VJQ0FnSUQ5eGZiZVpREAE,https://lh5.googleusercontent.com/p/AF1QipPBL5AHrlmKpiLzLqJGJMQ7luVPY-y82M8a25ky=w150-h150-k-no-p,https://lh5.googleusercontent.com/p/AF1QipM7QYM6-R2yPTxtnnHWYMPvqSneybnb44CFmn1w=w150-h150-k-no-p,https://lh5.googleusercontent.com/p/AF1QipP7cANDGphleH8o_VVkP6xsJZpRUACNWvUDercB=w150-h150-k-no-p,https://lh5.googleusercontent.com/p/AF1QipMQtVXz9Pol6ddHDxEMnwv7H8JZJxlyFot4VbqE=w150-h150-k-no-p,https://lh5.googleusercontent.com/p/AF1QipPjHFjjiIHpnJm58CxBXOruWS9vzrijVvv-krgd=w150-h150-k-no-p,Google,,103592480742513985111,,,,,,,,,,,,,,,,
Enrigo Italian Bistro,4,"Food is good, but short of amazing. The wait staff is really good, but there's bus staff and hosts that need to be trained a lot better, because they take away from the experience. I think the atmosphere is harmed by how many tables they have crammed into the place.",2024-03-13T12:47:09.290Z,0,,359,TRUE,,,a month ago,,Dinner,,$30–50,,Dine in,3,4,3,ChZDSUhNMG9nS0VJQ0FnSUQ5NU43U2ZREAE,,,,,,Google,,113200214945708747810,,,,,,,,,,,,,,,,
Enrigo Italian Bistro,5,"Great place for well-made, simple food.
My family ordered a variety of pastas, and we  enjoyed all of them. The bread was also served warm which was pleasant.
Also, we arrived with 5 people, which couldn’t fit a table properly, but the staff was very accommodating as they fit us into the restaurant.
Great place!",2024-03-06T01:05:13.678Z,0,,8,FALSE,,,a month ago,,,,,,,5,5,5,ChdDSUhNMG9nS0VJQ0FnSUM5M3JiYzdBRRAB,,,,,,Google,,108288487434796640375,,,,,,,,,,,,,,,,
Yoho Asian Bistro,5,Fantastic food and fair prices. Our fave even thou were not locals.,2024-04-23T01:58:40.967Z,0,,263,TRUE,,,18 hours ago,,,,,,,5,5,5,ChdDSUhNMG9nS0VJQ0FnSUNqOGV6Mm53RRAB,,,,,,Google,,100930317229465160081,,,,,,,,,,,,,,,,
Yoho Asian Bistro,4,,2024-04-20T20:46:53.833Z,0,,14,FALSE,,,2 days ago,,Dinner,,$20–30,,Dine in,3,4,4,ChdDSUhNMG9nS0VJQ0FnSUNqeHJxS3dnRRAB,,,,,,Google,,115936734182865240298,,,,,,,,,,,,,,,,
Yoho Asian Bistro,5,"Sushi was well above average, especially considering the buy one get one free roll. Will definitely be coming back through for great sushi at great prices. And my partner loved the cat robot.",2024-04-18T23:07:23.604Z,0,,2,FALSE,,,4 days ago,,Dinner,,$10–20,,Dine in,5,5,5,ChdDSUhNMG9nS0VJQ0FnSUNqM00zeWt3RRAB,,,,,,Google,,112630658278285993208,,,,,,,,,,,,,,,,
Yoho Asian Bistro,5,,2024-04-17T02:13:01.081Z,0,,1,FALSE,,,6 days ago,,,,,,,,,,ChZDSUhNMG9nS0VJQ0FnSUNqc0xXT0J3EAE,,,,,,Google,,104619088649332198816,,,,,,,,,,,,,,,,
Yoho Asian Bistro,5,Love this place. We will miss it. We're moving to the coast. We will go when we come back in town to visit.,2024-04-08T16:02:04.195Z,0,,69,TRUE,,,2 weeks ago,,Dinner,,$50–100,,Dine in,5,5,5,ChdDSUhNMG9nS0VJQ0FnSUREaHRPZjFRRRAB,,,,,,Google,,106341256001992457808,,,,,,,,,,,,,,,,
Yoho Asian Bistro,5,"LOVE THIS PLACE! I cannot express how much me and my family love to come here. Food is always prompt and delicious, love how clean it is all the time and service is fantastic. 100%",2024-04-07T14:32:03.609Z,0,,6,FALSE,,,2 weeks ago,,Lunch,,$10–20,,Dine in,5,5,5,ChZDSUhNMG9nS0VJQ0FnSUREMG9hVUZ3EAE,,,,,,Google,,105871821712203016850,,,,,,,,,,,,,,,,
Yoho Asian Bistro,5,I've been going here for years and always get a great value for what I order no matter whether you like sushi or just good Chinese food you always get exactly what you like and walk away full and happy.,2024-04-07T01:07:58.905Z,0,,30,FALSE,,,2 weeks ago,,,,,,,5,5,5,ChdDSUhNMG9nS0VJQ0FnSUREX016aW5RRRAB,,,,,,Google,,105169387052670528350,,,,,,,,,,,,,,,,
Yoho Asian Bistro,5,Love this place. Good sushi and good prices,2024-04-02T20:50:36.128Z,0,,112,TRUE,,,2 weeks ago,,Dinner,Plenty of parking,$20–30,,Dine in,5,5,5,ChZDSUhNMG9nS0VJQ0FnSUNEbDVUTU9nEAE,https://lh5.googleusercontent.com/p/AF1QipNHmNa92mNsnZSkzxIIebWUET5KVyqYR8YP_GFe=w150-h150-k-no-p,,,,,Google,,108713414201438422853,,,,,,,,,,,,,,,,
Yoho Asian Bistro,5,Man o man everything was A1,2024-03-31T22:45:04.066Z,0,,11,FALSE,,,3 weeks ago,,Dinner,,$10–20,,Dine in,5,5,5,ChZDSUhNMG9nS0VJQ0FnSUNEZzRmN2JREAE,,,,,,Google,,117271117157118105863,,,,,,,,,,,,,,,,
Yoho Asian Bistro,5,We have had takeout from here a number of times in the last few months. Food is always good and they have a huge selection of sushi (we haven’t tried anything else). It’s also very inexpensive and they are very nice.,2024-03-26T10:59:33.305Z,0,,32,FALSE,,,4 weeks ago,,Dinner,Plenty of parking,$10–20,,Take out,,5,5,ChZDSUhNMG9nS0VJQ0FnSUNEMHFhUVlREAE,,,,,,Google,,113567363454459584011,,,,,,,,,,,,,,,,
Yoho Asian Bistro,4,,2024-03-24T08:31:00.996Z,0,,1,FALSE,,,4 weeks ago,,,,,,,3,3,3,ChZDSUhNMG9nS0VJQ0FnSUNEdVAyOVBREAE,,,,,,Google,,108884311764555728539,,,,,,,,,,,,,,,,
Yoho Asian Bistro,2,My family and I made a reservation for 6 people. One of our guest couldn't make it. When they sat us down the waitress said where is your 6th person. I told her they can no longer make it. She went and got the host to make us move to a smaller table because we were no longer 6 guests we were only 5 guests. Minutes later they sat a family of 5 in that same spot they made us move. I was furious! I felt discriminated and shamed. The food was also very expensive and it really wasn't that good. I'll never be back there again. They don't welcome Hispanics and the food is mediocre,2024-03-23T12:09:15.132Z,0,,198,TRUE,,,a month ago,,,,,,Dine in,1,1,1,ChdDSUhNMG9nS0VJQ0FnSUQ5djVmdmhRRRAB,,,,,,Google,,101793527726564089783,,,,,,,,,,,,,,,,
Yoho Asian Bistro,1,Very racist place for Hispanics. I will never eat here again. They had move us to a smaller table in order to sit a white family with the same number of people in their family where we were. What for? No reason.,2024-03-22T22:12:59.363Z,0,,23,FALSE,,,a month ago,,Dinner,,$50–100,,Dine in,1,1,1,ChdDSUhNMG9nS0VJQ0FnSUQ5djVYb25RRRAB,,,,,,Google,,118054274876428668288,,,,,,,,,,,,,,,,
